### ISSUE TITLE
Connecting to Fortinet IPSec VPN

### ISSUE THREAD

**Issue by GoogleCodeExporter** [benjarobbi/get-a-robot-vpnc#60]
```
I'm not sure if this is the correct place to post my question, but I have
found no information in the net so...

Well, I'm trying to connect to a Fortinet IPSec VPN. Interesting
configuration points in Phase 1.
- Mode: Main
- Authentication Method: PSK
- Accept any peer ID
- Encryption: 3DES/SHA1 or 3DES/MD5
- no XAUTH

When I connect from my Hero I get Connection Failed.

Tcpdumping packets, I see just one-way communication: android->fortigate:
----------SOD----------------------
15:26:31.349649 IP 192.168.20.164.500 > 192.168.21.202.500: isakmp: phase 1
I agg
15:26:32.355190 IP 192.168.20.164.500 > 192.168.21.202.500: isakmp: phase 1
I agg
15:26:32.355209 IP 192.168.20.164.500 > 192.168.21.202.500: isakmp: phase 1
I agg
15:26:34.364773 IP 192.168.20.164.500 > 192.168.21.202.500: isakmp: phase 1
I agg
15:26:34.364804 IP 192.168.20.164.500 > 192.168.21.202.500: isakmp: phase 1
I agg
15:26:38.372451 IP 192.168.20.164.500 > 192.168.21.202.500: isakmp: phase 1
I agg
15:26:38.372476 IP 192.168.20.164.500 > 192.168.21.202.500: isakmp: phase 1
I agg
----------EOD----------------------

Any idea? Can the encryption be the cause? I have tried using other
Encription methods but I keep on getting the same problem.

Thanks in advance, and sorry if this is not the right place to post.

David
```

Original issue reported on code.google.com by `edisk...@gmail.com` on 23 Feb 2010 at 2:28
